[
  {
    "id": "interaction_acct_brightlane_creative",
    "account_id": "acct_brightlane_creative",
    "draft_type": "warm_follow_up",
    "summary": "Andre asked for a short example of how an agency referral pipeline report would look after a discovery call.",
    "last_interaction_at": "2026-06-06",
    "next_action": "Send a concise follow-up with one agency-specific proof point and offer a three-account sample.",
    "source": "fixture previous interactions",
    "confidence": "medium",
    "created_at": "2026-06-11T22:30:00.000Z",
    "updated_at": "2026-06-11T22:30:00.000Z"
  },
  {
    "id": "interaction_acct_harbor_it_advisors",
    "account_id": "acct_harbor_it_advisors",
    "draft_type": "stale_opportunity_revive",
    "summary": "Renewal follow-up idea was discussed last month but stalled before a concrete next step.",
    "last_interaction_at": "2026-05-09",
    "next_action": "Ask whether renewal follow-up discipline is still worth revisiting this quarter.",
    "source": "fixture previous interactions",
    "confidence": "medium",
    "created_at": "2026-06-11T22:30:00.000Z",
    "updated_at": "2026-06-11T22:30:00.000Z"
  },
  {
    "id": "interaction_acct_cedar_grant_partners",
    "account_id": "acct_cedar_grant_partners",
    "draft_type": "meeting_recap",
    "summary": "Prior conversation focused on deadline-sensitive grant follow-ups and compliance-safe language.",
    "last_interaction_at": "2026-06-04",
    "next_action": "Recap the compliance concern and ask whether legal review is needed before any draft is used.",
    "source": "fixture previous interactions",
    "confidence": "medium",
    "created_at": "2026-06-11T22:30:00.000Z",
    "updated_at": "2026-06-11T22:30:00.000Z"
  },
  {
    "id": "interaction_acct_signalworks_strategy",
    "account_id": "acct_signalworks_strategy",
    "draft_type": "referral_request",
    "summary": "Nora mentioned warm founder referrals as the best source of qualified consulting opportunities.",
    "last_interaction_at": "2026-06-02",
    "next_action": "Ask for one specific referral profile rather than broad introductions.",
    "source": "fixture previous interactions",
    "confidence": "medium",
    "created_at": "2026-06-11T22:30:00.000Z",
    "updated_at": "2026-06-11T22:30:00.000Z"
  },
  {
    "id": "interaction_acct_orbit_founder_office",
    "account_id": "acct_orbit_founder_office",
    "draft_type": "meeting_recap",
    "summary": "Demo notes and investor update follow-ups were discussed as the highest-friction context sources.",
    "last_interaction_at": "2026-06-03",
    "next_action": "Recap the workflow gaps and suggest a small follow-up cockpit sample.",
    "source": "fixture previous interactions",
    "confidence": "medium",
    "created_at": "2026-06-11T22:30:00.000Z",
    "updated_at": "2026-06-11T22:30:00.000Z"
  },
  {
    "id": "interaction_acct_mapleworks_digital",
    "account_id": "acct_mapleworks_digital",
    "draft_type": "stale_opportunity_revive",
    "summary": "Old discovery notes suggest several stale local-services opportunities that were never revived.",
    "last_interaction_at": "2026-04-22",
    "next_action": "Ask whether stale opportunity revive drafts would be useful before rebuilding the whole pipeline.",
    "source": "fixture previous interactions",
    "confidence": "medium",
    "created_at": "2026-06-11T22:30:00.000Z",
    "updated_at": "2026-06-11T22:30:00.000Z"
  }
]
